{
  "$schema": "https://json-schema.org/draft/2020-12/schema",
  "$id": "https://x2knwldg.local/schemas/extraction_bundle.schema.json",
  "title": "X2KNWLDG extraction bundle",
  "description": "The bundle an extraction produces before it becomes canonical output. Knowledge unit ids must be usable as one segment of a three-part global id (D-011): no colon, no whitespace, no leading dot, so that '.' and '..' can never appear. src/x2knwldg/ids.py is the single implementation of that rule and validators.py enforces it at validation time (D-018).",
  "type": "object",
  "required": [
    "knowledge_units",
    "relationships",
    "coverage"
  ],
  "properties": {
    "extraction_metadata": {
      "type": "object"
    },
    "knowledge_units": {
      "type": "array",
      "items": {
        "$ref": "#/$defs/knowledgeUnit"
      }
    },
    "relationships": {
      "type": "array",
      "items": {
        "$ref": "#/$defs/relationship"
      }
    },
    "coverage": {
      "type": "object",
      "required": [
        "status",
        "audit_attempts",
        "windows"
      ],
      "properties": {
        "status": {
          "enum": [
            "PASS",
            "PARTIAL",
            "FAIL"
          ]
        },
        "audit_attempts": {
          "$comment": "minimum 0, not 1: coverage.create_pending_coverage writes 0 into every fresh run, WORKFLOW.md \u00a74.4 and prompts/05 both describe 0 as the honest never-audited state, and validators.validate_coverage accepts 0 while refusing it alongside a PASS claim (unaudited_coverage_pass). The schema was the one artifact of the four that rejected the document the pipeline actually produces. maximum is constants.MAX_AUDIT_ATTEMPTS, asserted against it in tests/test_index_schemas.py.",
          "type": "integer",
          "minimum": 0,
          "maximum": 3
        },
        "windows": {
          "type": "array",
          "items": {
            "type": "object",
            "required": [
              "window_id",
              "start_sec",
              "end_sec",
              "status",
              "knowledge_units",
              "omitted_items",
              "unresolved_items"
            ],
            "properties": {
              "window_id": {
                "type": "string"
              },
              "start_sec": {
                "type": "number",
                "minimum": 0
              },
              "end_sec": {
                "type": "number",
                "minimum": 0
              },
              "status": {
                "$comment": "The window vocabulary is constants.COVERAGE_STATUSES. `pending` was missing while coverage.py wrote it into every window of a fresh run, so the schema described a document the code does not produce.",
                "enum": [
                  "pending",
                  "covered",
                  "uncovered",
                  "omitted",
                  "partial"
                ]
              },
              "knowledge_units": {
                "type": "array",
                "items": {
                  "type": "string"
                }
              },
              "omitted_items": {
                "type": "array",
                "items": {
                  "$comment": "D-092: this was a bare object schema with no properties, so it accepted an entry keyed `reason` that validators.validate_coverage then rejected as `invalid_omission_reason` naming null - and the key names appeared only in validators.py and an archival spec the workflow never links. The vocabulary is constants.OMISSION_REASONS, asserted against it in tests/test_index_schemas.py.",
                  "type": "object",
                  "required": [
                    "type"
                  ],
                  "properties": {
                    "type": {
                      "enum": [
                        "audience_reaction",
                        "housekeeping",
                        "intro_noninformational",
                        "off_topic",
                        "source_unavailable",
                        "other_explained",
                        "repetition",
                        "small_talk",
                        "sponsor",
                        "transition",
                        "unintelligible"
                      ],
                      "$comment": "The controlled vocabulary is constants.OMISSION_REASONS and tests/test_index_schemas.py asserts this enum equals it. `source_unavailable` joined for T-227 (D-225): an included post that was never observed has no content to audit, and the omission is minted by the pipeline rather than chosen by an auditor, so it is a named reason and not `other_explained`."
                    },
                    "note": {
                      "type": "string"
                    }
                  },
                  "if": {
                    "required": [
                      "type"
                    ],
                    "properties": {
                      "type": {
                        "const": "other_explained"
                      }
                    }
                  },
                  "then": {
                    "required": [
                      "type",
                      "note"
                    ],
                    "properties": {
                      "note": {
                        "$comment": "`\\\\S` rather than minLength alone: validate_coverage tests str(note).strip(), so a note of only spaces is a missing explanation to it and would be an accepted one here. The two gates must not disagree.",
                        "type": "string",
                        "minLength": 1,
                        "pattern": "\\S"
                      }
                    }
                  },
                  "additionalProperties": true
                }
              },
              "unresolved_items": {
                "type": "array",
                "items": {
                  "type": "object"
                }
              }
            },
            "additionalProperties": true
          }
        }
      },
      "additionalProperties": true
    }
  },
  "$defs": {
    "knowledgeUnit": {
      "type": "object",
      "required": [
        "id",
        "kind",
        "source_class",
        "content",
        "confidence"
      ],
      "properties": {
        "id": {
          "type": "string",
          "minLength": 1,
          "maxLength": 256,
          "pattern": "^[A-Za-z0-9_-][A-Za-z0-9._-]*$"
        },
        "kind": {
          "$comment": "constants.KNOWLEDGE_KINDS, drift-tested in tests/test_index_schemas.py. `canonical_concept` is deliberately absent: library.py mints it for a concept node and no bundle carries one. This used to be `type: string, minLength: 1`, so a model that validated its output against the published schema still got `invalid_kind` out of validators.py \u2014 the schema blessed a bundle apply-bundle then rejected.",
          "enum": [
            "actionable_experiment",
            "analogy",
            "assumption",
            "case_study",
            "caveat",
            "claim",
            "concept",
            "counterargument",
            "definition",
            "diagnostic_model",
            "evidence",
            "example",
            "fact",
            "framework",
            "generalized_rule",
            "hypothesis",
            "implication",
            "instruction",
            "limitation",
            "mental_model",
            "open_problem",
            "principle",
            "process",
            "question",
            "quote",
            "recommendation",
            "reference",
            "relationship",
            "statistic",
            "synthesis"
          ]
        },
        "source_class": {
          "enum": [
            "source",
            "derived"
          ]
        },
        "content": {
          "type": "string",
          "minLength": 1
        },
        "confidence": {
          "type": "number",
          "minimum": 0,
          "maximum": 1
        },
        "source": {
          "type": "object"
        },
        "derived_from": {
          "type": "array",
          "items": {
            "type": "string",
            "minLength": 1,
            "maxLength": 256,
            "pattern": "^[A-Za-z0-9_-][A-Za-z0-9._-]*$"
          }
        },
        "derivation_note": {
          "type": "string"
        }
      },
      "additionalProperties": true,
      "allOf": [
        {
          "$comment": "validators.validate_knowledge_units: `requires_provenance = source_class == \"source\" or kind in SOURCE_KINDS`, so the obligation follows the kind as well as the declaration and a unit cannot shed it by mislabelling itself. The schema required no `source` block at all, so a `source_class: \"source\"` unit without one validated here and came back `missing_source`.",
          "if": {
            "anyOf": [
              {
                "properties": {
                  "source_class": {
                    "const": "source"
                  }
                },
                "required": [
                  "source_class"
                ]
              },
              {
                "properties": {
                  "kind": {
                    "enum": [
                      "analogy",
                      "assumption",
                      "case_study",
                      "caveat",
                      "claim",
                      "concept",
                      "counterargument",
                      "definition",
                      "evidence",
                      "example",
                      "fact",
                      "framework",
                      "instruction",
                      "limitation",
                      "open_problem",
                      "principle",
                      "process",
                      "question",
                      "quote",
                      "recommendation",
                      "reference",
                      "statistic"
                    ]
                  }
                },
                "required": [
                  "kind"
                ]
              }
            ]
          },
          "then": {
            "required": [
              "source"
            ],
            "properties": {
              "source": {
                "type": "object",
                "required": [
                  "video_id",
                  "segment_id",
                  "start_sec",
                  "end_sec",
                  "evidence_excerpt"
                ]
              }
            }
          }
        }
      ]
    },
    "relationship": {
      "type": "object",
      "required": [
        "from",
        "relation",
        "to",
        "confidence",
        "source_class"
      ],
      "properties": {
        "from": {
          "type": "string",
          "minLength": 1,
          "maxLength": 256,
          "pattern": "^[A-Za-z0-9_-][A-Za-z0-9._-]*$"
        },
        "relation": {
          "$comment": "constants.RELATION_TYPES, drift-tested in tests/test_index_schemas.py. It used to be a bare `type: string` with no enum and no minLength, so `\"\"` and `folklore` both validated and both came back `invalid_relation`.",
          "enum": [
            "causes",
            "contradicts",
            "contributes_to",
            "depends_on",
            "enables",
            "exemplifies",
            "inhibits",
            "is_evidence_for",
            "is_example_of",
            "is_part_of",
            "precedes",
            "qualifies",
            "refines",
            "related_to",
            "results_in",
            "supports"
          ]
        },
        "to": {
          "type": "string",
          "minLength": 1,
          "maxLength": 256,
          "pattern": "^[A-Za-z0-9_-][A-Za-z0-9._-]*$"
        },
        "confidence": {
          "type": "number",
          "minimum": 0,
          "maximum": 1
        },
        "source_class": {
          "enum": [
            "source",
            "derived"
          ]
        }
      },
      "additionalProperties": true
    }
  },
  "additionalProperties": false
}
